name,id,stripped_tweet,time
bnogr,16218491,"Troktiko News Μήνυση κατά ανακριτριών και εισαγγελέα κατέθεσε ο Κασιδιάρης: Μήνυση σε βάρος των ανακριτριών τη...",1389948981
Kateveio,956133162,"Στα δικαστήρια ο Κασιδιάρης",1389948908
Makeleio_gr,521308614,"Μηνύσεις κατά ανακριτριών και εισαγγελέα από την Χρυσή Αυγή – Κασιδιάρης: «Δεν υφίσταται θέμα ανθρωπίνου λάθους»",1389948678
AngelEvi,73170367,"Ο Κασιδιάρης κατηγορείται για εγκληματική οργάνωση, έχει 50 φωτογραφίες με όπλα και είναι ελεύθερος.Αν είχαν φωτο του",1389948501
axiaplus,538154104,"Ο Κασιδιάρης μοίρασε μηνύσεις! - AxiaPlus - 24 Hours News",1389948361
Stratigos_,2236318519,"Ο εκπρόσωπος Τύπου της Χρυσής Αυγής, Ηλίας Κασιδιάρης, κατέθεσε σήμερα μήνυση σε βάρο...",1389948361
CyprusNewsEu,219110145,"Η.Κασιδιάρης: Μηνύει τους ανακριτές της υπόθεσης της Χ.Α.",1389948124
